{
    "schemaVersion":  1,
    "recordedAtUtc":  "2026-10-05T20:46:52.8970172+00:00",
    "releaseGate":  "BLOCKED",
    "provenance":  {
                       "operator":  "",
                       "os":  "Microsoft Windows NT 10.0.26200.0",
                       "architecture":  "AMD64",
                       "packageSha256":  "EFF0453D9DAB824E173CE87A6526A762D33D1E286098986E8F214BA7A7BA10E3",
                       "devices":  [

                                   ],
                       "limitations":  [
                                           "Physical peers, an installed package, interactive operator, and Windows accessibility/display controls have not been verified in this environment."
                                       ]
                   },
    "results":  [
                    {
                        "id":  "Windows/outgoing/discovery-offline-rediscovery",
                        "peer":  "Windows",
                        "scenario":  "outgoing-discovery-offline-rediscovery",
                        "status":  "NOT_RUN",
                        "reason":  "Physical peers, an installed package, interactive operator, and Windows accessibility/display controls have not been verified in this environment.",
                        "observedAtUtc":  "",
                        "deviceIds":  [

                                      ],
                        "evidence":  [

                                     ]
                    },
                    {
                        "id":  "Windows/outgoing/pairing-match-mismatch-reject-timeout",
                        "peer":  "Windows",
                        "scenario":  "outgoing-pairing-match-mismatch-reject-timeout",
                        "status":  "NOT_RUN",
                        "reason":  "Physical peers, an installed package, interactive operator, and Windows accessibility/display controls have not been verified in this environment.",
                        "observedAtUtc":  "",
                        "deviceIds":  [

                                      ],
                        "evidence":  [

                                     ]
                    },
                    {
                        "id":  "Windows/outgoing/trust-forget-restart",
                        "peer":  "Windows",
                        "scenario":  "outgoing-trust-forget-restart",
                        "status":  "NOT_RUN",
                        "reason":  "Physical peers, an installed package, interactive operator, and Windows accessibility/display controls have not been verified in this environment.",
                        "observedAtUtc":  "",
                        "deviceIds":  [

                                      ],
                        "evidence":  [

                                     ]
                    },
                    {
                        "id":  "Windows/outgoing/identity-change-block",
                        "peer":  "Windows",
                        "scenario":  "outgoing-identity-change-block",
                        "status":  "NOT_RUN",
                        "reason":  "Physical peers, an installed package, interactive operator, and Windows accessibility/display controls have not been verified in this environment.",
                        "observedAtUtc":  "",
                        "deviceIds":  [

                                      ],
                        "evidence":  [

                                     ]
                    },
                    {
                        "id":  "Windows/outgoing/text-trusted-autoaccept",
                        "peer":  "Windows",
                        "scenario":  "outgoing-text-trusted-autoaccept",
                        "status":  "NOT_RUN",
                        "reason":  "Physical peers, an installed package, interactive operator, and Windows accessibility/display controls have not been verified in this environment.",
                        "observedAtUtc":  "",
                        "deviceIds":  [

                                      ],
                        "evidence":  [

                                     ]
                    },
                    {
                        "id":  "Windows/outgoing/text-untrusted-decision",
                        "peer":  "Windows",
                        "scenario":  "outgoing-text-untrusted-decision",
                        "status":  "NOT_RUN",
                        "reason":  "Physical peers, an installed package, interactive operator, and Windows accessibility/display controls have not been verified in this environment.",
                        "observedAtUtc":  "",
                        "deviceIds":  [

                                      ],
                        "evidence":  [

                                     ]
                    },
                    {
                        "id":  "Windows/outgoing/image-offer",
                        "peer":  "Windows",
                        "scenario":  "outgoing-image-offer",
                        "status":  "NOT_RUN",
                        "reason":  "Physical peers, an installed package, interactive operator, and Windows accessibility/display controls have not been verified in this environment.",
                        "observedAtUtc":  "",
                        "deviceIds":  [

                                      ],
                        "evidence":  [

                                     ]
                    },
                    {
                        "id":  "Windows/outgoing/file-integrity",
                        "peer":  "Windows",
                        "scenario":  "outgoing-file-integrity",
                        "status":  "NOT_RUN",
                        "reason":  "Physical peers, an installed package, interactive operator, and Windows accessibility/display controls have not been verified in this environment.",
                        "observedAtUtc":  "",
                        "deviceIds":  [

                                      ],
                        "evidence":  [

                                     ]
                    },
                    {
                        "id":  "Windows/outgoing/clipboard-source-text",
                        "peer":  "Windows",
                        "scenario":  "outgoing-clipboard-source-text",
                        "status":  "NOT_RUN",
                        "reason":  "Physical peers, an installed package, interactive operator, and Windows accessibility/display controls have not been verified in this environment.",
                        "observedAtUtc":  "",
                        "deviceIds":  [

                                      ],
                        "evidence":  [

                                     ]
                    },
                    {
                        "id":  "Windows/outgoing/clipboard-source-image",
                        "peer":  "Windows",
                        "scenario":  "outgoing-clipboard-source-image",
                        "status":  "NOT_RUN",
                        "reason":  "Physical peers, an installed package, interactive operator, and Windows accessibility/display controls have not been verified in this environment.",
                        "observedAtUtc":  "",
                        "deviceIds":  [

                                      ],
                        "evidence":  [

                                     ]
                    },
                    {
                        "id":  "Windows/outgoing/receiver-clipboard-unchanged",
                        "peer":  "Windows",
                        "scenario":  "outgoing-receiver-clipboard-unchanged",
                        "status":  "NOT_RUN",
                        "reason":  "Physical peers, an installed package, interactive operator, and Windows accessibility/display controls have not been verified in this environment.",
                        "observedAtUtc":  "",
                        "deviceIds":  [

                                      ],
                        "evidence":  [

                                     ]
                    },
                    {
                        "id":  "Windows/outgoing/accept-reject",
                        "peer":  "Windows",
                        "scenario":  "outgoing-accept-reject",
                        "status":  "NOT_RUN",
                        "reason":  "Physical peers, an installed package, interactive operator, and Windows accessibility/display controls have not been verified in this environment.",
                        "observedAtUtc":  "",
                        "deviceIds":  [

                                      ],
                        "evidence":  [

                                     ]
                    },
                    {
                        "id":  "Windows/outgoing/active-cancel",
                        "peer":  "Windows",
                        "scenario":  "outgoing-active-cancel",
                        "status":  "NOT_RUN",
                        "reason":  "Physical peers, an installed package, interactive operator, and Windows accessibility/display controls have not been verified in this environment.",
                        "observedAtUtc":  "",
                        "deviceIds":  [

                                      ],
                        "evidence":  [

                                     ]
                    },
                    {
                        "id":  "Windows/outgoing/timeout",
                        "peer":  "Windows",
                        "scenario":  "outgoing-timeout",
                        "status":  "NOT_RUN",
                        "reason":  "Physical peers, an installed package, interactive operator, and Windows accessibility/display controls have not been verified in this environment.",
                        "observedAtUtc":  "",